[
  {
    "id": "RULE-0001",
    "rule_type": "player",
    "player_key": "Kohli, V",
    "condition": { "is_chasing": true, "match_type": ["T20", "IPL"] },
    "impact_score": 22,
    "confidence": 0.87,
    "description": "Virat Kohli averages significantly higher while chasing in T20 cricket",
    "source": "Career T20 chasing avg 54.2 vs setting avg 34.1 (Cricsheet 2016-2026)",
    "match_types": ["T20", "IPL"],
    "is_active": true,
    "valid_from": null,
    "valid_until": null
  },
  {
    "id": "RULE-0002",
    "rule_type": "player",
    "player_key": "Sharma, RG",
    "condition": { "opposition_bowling_type": "pace_left", "pitch_type": "pace" },
    "impact_score": -18,
    "confidence": 0.82,
    "description": "Rohit Sharma has a notable weakness against left-arm pace on bouncy pitches",
    "source": "Dismissal rate vs left-arm pace: 0.042/ball vs career 0.021/ball (Cricsheet)",
    "match_types": null,
    "is_active": true,
    "valid_from": null,
    "valid_until": null
  },
  {
    "id": "RULE-0003",
    "rule_type": "player",
    "player_key": "Russell, AD",
    "condition": { "pitch_type": "batting", "match_type": ["T20", "IPL"] },
    "impact_score": 35,
    "confidence": 0.85,
    "description": "Andre Russell is extremely dangerous on flat batting pitches in T20s",
    "source": "FP avg on batting pitches: 68.2 vs overall avg 48.1 (Cricsheet IPL 2018-2026)",
    "match_types": ["T20", "IPL"],
    "is_active": true,
    "valid_from": null,
    "valid_until": null
  },
  {
    "id": "RULE-0004",
    "rule_type": "player",
    "player_key": "Bumrah, JJ",
    "condition": { "match_type": ["T20", "IPL"], "phase": "death" },
    "impact_score": 28,
    "confidence": 0.91,
    "description": "Jasprit Bumrah is the most effective death-overs bowler in T20 cricket",
    "source": "Death overs economy: 7.1 (best among bowlers with 50+ death overs, Cricsheet 2018-2026)",
    "match_types": ["T20", "IPL"],
    "is_active": true,
    "valid_from": null,
    "valid_until": null
  },
  {
    "id": "RULE-0005",
    "rule_type": "player",
    "player_key": "Dhoni, MS",
    "condition": { "is_final_or_knockout": true, "batting_position": [5, 6, 7] },
    "impact_score": 20,
    "confidence": 0.75,
    "description": "MS Dhoni performs significantly above average in pressure matches and finisher role",
    "source": "Knockout FP avg: 42.3 vs regular match avg 28.1 (Cricsheet IPL 2013-2024)",
    "match_types": ["T20", "IPL"],
    "is_active": true,
    "valid_from": null,
    "valid_until": null
  },
  {
    "id": "RULE-0006",
    "rule_type": "player",
    "player_key": "Shami, Mohammed",
    "condition": { "match_type": "ODI", "is_chasing": false },
    "impact_score": 18,
    "confidence": 0.78,
    "description": "Mohammed Shami is highly effective when bowling in first innings in ODIs",
    "source": "1st innings wickets avg: 3.1 vs 2nd innings: 1.9 (Cricsheet ODI 2019-2026)",
    "match_types": ["ODI"],
    "is_active": true,
    "valid_from": null,
    "valid_until": null
  },
  {
    "id": "RULE-0007",
    "rule_type": "player",
    "player_key": "Stokes, BA",
    "condition": { "is_final_or_knockout": true },
    "impact_score": 25,
    "confidence": 0.83,
    "description": "Ben Stokes consistently elevates performance in high-pressure matches",
    "source": "Knockout match FP avg: 55.2 vs regular: 39.4 (Cricsheet all formats 2015-2026)",
    "match_types": null,
    "is_active": true,
    "valid_from": null,
    "valid_until": null
  },
  {
    "id": "RULE-0008",
    "rule_type": "player",
    "player_key": "Warner, DA",
    "condition": { "venue": "Sydney", "match_type": ["T20", "BBL"] },
    "impact_score": 20,
    "confidence": 0.76,
    "description": "David Warner has an exceptional record at Sydney Cricket Ground",
    "source": "SCG FP avg: 58.1 vs career avg 41.2 (Cricsheet BBL+T20 2012-2026)",
    "match_types": ["T20", "BBL"],
    "is_active": true,
    "valid_from": null,
    "valid_until": null
  }
]
